{
  "$schema": "https://json-schema.org/draft/2020-12/schema",
  "$id": "https://nexus-lab-test-bed.local/contracts/domain/customer.schema.json",
  "title": "customer",
  "type": "array",
  "items": {
    "type": "object",
    "additionalProperties": false,
    "properties": {
      "account_code": {
        "$ref": "https://nexus-lab-test-bed.local/contracts/domain/domain-common.schema.json#/$defs/code"
      },
      "name": {
        "type": "string",
        "minLength": 1
      },
      "contact_name": {
        "type": "string"
      },
      "email": {
        "type": "string",
        "format": "email"
      },
      "phone": {
        "type": "string"
      },
      "billing_address_line1": {
        "type": ["string", "null"]
      },
      "billing_address_line2": {
        "type": ["string", "null"]
      },
      "billing_city": {
        "type": "string"
      },
      "billing_state": {
        "type": "string"
      },
      "billing_postal_code": {
        "type": "string"
      },
      "billing_country": {
        "type": "string"
      },
      "shipping_address_line1": {
        "type": ["string", "null"]
      },
      "shipping_address_line2": {
        "type": ["string", "null"]
      },
      "shipping_city": {
        "type": "string"
      },
      "shipping_state": {
        "type": "string"
      },
      "shipping_postal_code": {
        "type": "string"
      },
      "shipping_country": {
        "type": "string"
      },
      "is_active": {
        "type": "boolean"
      }
    },
    "required": [
      "account_code",
      "name",
      "billing_city",
      "billing_state",
      "billing_postal_code",
      "billing_country",
      "shipping_city",
      "shipping_state",
      "shipping_postal_code",
      "shipping_country",
      "is_active"
    ]
  }
}
