[
  {
    "account_code": "CUST-ACME",
    "name": "Acme Manufacturing Co.",
    "contact_name": "Dana Rivera",
    "email": "ops@acme-mfg.example",
    "phone": "+1-555-0101",
    "billing_address_line1": "100 Industrial Way",
    "billing_address_line2": "Suite 200",
    "billing_city": "Coldspring",
    "billing_state": "TX",
    "billing_postal_code": "77331",
    "billing_country": "US",
    "shipping_address_line1": "100 Industrial Way",
    "shipping_address_line2": "Dock 3",
    "shipping_city": "Coldspring",
    "shipping_state": "TX",
    "shipping_postal_code": "77331",
    "shipping_country": "US",
    "is_active": true
  },
  {
    "account_code": "CUST-NORTHSTAR",
    "name": "Northstar Components LLC",
    "contact_name": "Lee Chen",
    "email": "supply@northstar.example",
    "phone": "+1-555-0102",
    "billing_address_line1": "42 Supply Chain Blvd",
    "billing_address_line2": null,
    "billing_city": "Houston",
    "billing_state": "TX",
    "billing_postal_code": "77001",
    "billing_country": "US",
    "shipping_address_line1": "42 Supply Chain Blvd",
    "shipping_address_line2": null,
    "shipping_city": "Houston",
    "shipping_state": "TX",
    "shipping_postal_code": "77001",
    "shipping_country": "US",
    "is_active": true
  },
  {
    "account_code": "CUST-SKYRIDGE",
    "name": "Skyridge Robotics",
    "contact_name": "Morgan Patel",
    "email": "purchasing@skyridge-robotics.example",
    "phone": "+1-555-0103",
    "billing_address_line1": "500 Innovation Loop",
    "billing_address_line2": "Floor 5",
    "billing_city": "Austin",
    "billing_state": "TX",
    "billing_postal_code": "73301",
    "billing_country": "US",
    "shipping_address_line1": "500 Innovation Loop",
    "shipping_address_line2": "Receiving",
    "shipping_city": "Austin",
    "shipping_state": "TX",
    "shipping_postal_code": "73301",
    "shipping_country": "US",
    "is_active": true
  }
]
